{
    "$schema": "../schemas/async_size_response.json",
    "job_id": "88888888-4444-4444-4444-cccccccccccc",
    "tasks": [
        {
            "task": "workload_sizing",
            "status": "COMPLETE",
            "progress": 100
        },
        {
            "task": "appliance_sizing",
            "status": "COMPLETE",
            "progress": 100
        }
    ],
    "workload_results": [
        {
            "example": "results go here"
        }
    ],
    "appliance_results": {
        "$schema": "../schemas/async_size_response.json",
        "site_assignments": [],
        "horizon": {
            "num_years": 1,
            "planning_year": 1
        },
        "windows": {
            "full_backup_hours": 0,
            "incremental_backup_hours": 0,
            "replication_hours": 0
        }
    }
}